{
  "image_path": "synthetic_cases/blur_sigma_1_5/image.png",
  "template_path": "synthetic_cases/blur_sigma_1_5/template.png",
  "output_path": "blur_sigma_result.json",
  "topk": 1,
  "compile": {
    "max_levels": 3,
    "coarse_step_deg": 30.0,
    "min_step_deg": 7.5,
    "fill_value": 0,
    "precompute_coarsest": true
  },
  "match": {
    "metric": "zncc",
    "rotation": "disabled",
    "parallel": false,
    "max_image_levels": 5,
    "beam_width": 8,
    "per_angle_topk": 3,
    "nms_radius": 6,
    "roi_radius": 8,
    "angle_half_range_steps": 1,
    "min_var_i": 1e-8,
    "min_score": 0.65
  }
}
